#APPLICATION,PURPOSE,LINK,ALTERNATIVE LINK
brave-browser,"is a fast, private and secure web browser.","https://brave.com/linux/",
dropbox,"can be used to sync files between devices","https://www.dropbox.com/install?os=lnx",
obs,"is a screen recorder","https://obsproject.com/",
rclone,"is rsync for cloud storage","https://rclone.org/docs/",
sioyek,"is a PDF viewer","https://github.com/ahrm/sioyek",
slack,"is a communication platform for work.","https://slack.com/intl/en-nl/downloads/linux",
spotify,"is a digital streaming service for music.","https://www.spotify.com/nl/download/linux/",
veracrypt,"is disk encryption software.",https://veracrypt.io/en/Downloads.html,
